user_input,retrieved_contexts,response,reference,context_precision,context_recall
江西省交通投资集团的主要业务是什么？,"['![img](https://www.jxgsgl.com/1ywuKELSO2ahQuWZ/pr/0/r/e00a0e273cb8/f8904Gw9N0y_Xfwc846qx_qqGZMkDyP536G8ktq3QuNR05_YvdH2LYd_eo4%2Bw4NCPDKmlUhLCJch3S4wO2qe6OAx%2BQ_BCEZg9Yr%2B4lT1i4Q%3D/0202504161809133320.jpg)\n\u3000\u3000谢兼法对刘震华一行的到来表示欢迎，并介绍了集团的改革发展情况。他表示，近年来，省交通投资集团加快向国有资本投资运营公司转型，在积极扩大高速公路有效投资、优化高速公路网络布局的同时，大力培育和发展新质生产力，努力打造一流的投融资平台和产业孵化平台，更好服务全省经济社会高质量发展。省铁航集团与省交通投资集团同为省属企业，在服务全省发展大局中使命相通。期待双方进一步加强沟通交流，深化互利合作，在奋力谱写中国式现代化江西篇章中更好发挥交通先行和国有经济战略支撑作用。', '2月8日，在浙江交通集团举行的建设“创新交投”工作会议暨技术研究总院成立仪式上，该集团分别与萧山区人民政府签署战略合作协议、与萧山经济技术开发区管委会签署项目合作协议，计划未来10年投入100亿元打造集科技创新、企业孵化、中试基地、成果转化等为一体的重大创新平台。\n\n![img](https://img-xhpfm.xinhuaxmt.com/News/202502/GzjfshC007008_20250210_CBMFN0A001.png?x-oss-process=image/resize,w_1000/auto-orient,1/quality,Q_80)\n\n在不断创新发展中壮大的浙江交通集团，是浙江交通建设、发展的主力军，也是资产规模最大的浙江省属国有企业、全省交通产业链链主。当前，该集团围绕传统产业提质增效、新兴产业培育壮大、未来产业前瞻布局主线，开展业态布局调优、创新平台提质、关键技术攻坚、创新成果转化等创新行动，加快向以创新驱动为主的发展模式转变。']","![img](https://www.jxgsgl.com/1ywuKELSO2ahQuWZ/pr/0/r/e00a0e273cb8/f8904Gw9N0y_Xfwc846qx_qqGZMkDyP536G8ktq3QuNR05_YvdH2LYd_eo4%2Bw4NCPDKmlUhLCJch3S4wO2qe6OAx%2BQ_BCEZg9Yr%2B4lT1i4Q%3D/0202504161809133320.jpg)
　　谢兼法对刘震华一行的到来表示欢迎，并介绍了集团的改革发展情况。他表示，近年来，省交通投资集团加快向国有资本投资运营公司转型，在积极扩大高速公路有效投资、优化高速公路网络布局的同时",江西省交通投资集团主要负责省内交通基础设施的投资、建设和运营管理。,0.9999999999,0.0
交通运输部的主要职能是什么？,['第七章\u3000交通治理体系治理能力现代化\n261 下篇\n 第七章 交通治理体系治理能力现代化 为深入贯彻落实党的十九届四中全会决策部署，推进交通运输治理体系和治理能力现代化， 服务加快建设交通强国，交通运输部印发《关于推进交通运输治理体系和治理能力现代化若干问 题的意见》，明确了当前和今后一个时期推进交通运输治理现代化的指导思想、总体目标和重点 举措，围绕行业体制机制改革、制度体系完善、政策手段创新、发展模式变革等内容，提出了14 个方面42 项重点任务，形成了新时期行业全面深化改革的总体设计。\n（一）体制机制改革 公路领域中央与地方财政事权和支出责任划分改革 （中国公路学会\u3000孙虎成） 2019 年6 月26 日，《国务院办公厅关于印发交通运输领域中央与地方财政事权和支出责任 划分改革方案的通知》（国办发〔2019〕33 号）（以下简称33 号文））正式颁布，酝酿多年的 交通运输领域中央与地方财政事权与支出责任改革取得重大突破。此次改革，是在交通运输行业 深化财税体制改革的一项重要工作，必将对公路行业发展产生深远影响。'],"第七章　交通治理体系治理能力现代化
261 下篇
 第七章 交通治理体系治理能力现代化 为深入贯彻落实党的十九届四中全会决策部署，推进交通运输治理体系和治理能力现代化， 服务加快建设交通强国，交通运输部印发《关于推进交通运输治理体系和治理能力现代化若干问 题的意见》，明确了当前和今后一个时期推进交通运输治理现代化的指导思想、总体目标和重点 举措，围绕行业体制机制改革、制度体系完善、政策手段创新、发展模式变革等内容，提出了14 个方面42 项重点任务，形成了新时期行业全面深化改革的总体设计。
（一）体制机制改革 公路领域中央与地方财政事权和支出责任划分改革 （中国公路学会　孙虎成） 2019 年",交通运输部负责拟订公路、水路行业标准，推动交通运输行业发展。,0.0,0.0
