user_input,retrieved_contexts,response,reference,context_precision,context_recall
2024年全省综合运输春运工作电视电话会议由哪位领导主持？,"['2024年全省综合运输春运工作电视电话会议召开\n2024-01-25\nhttp://jt.jiangxi.gov.cn/art/2024/1/25/art_32667_4770174.html', '2月20日，省综合交通中心在南昌召开全省道路运输工作部署会，贯彻落实2025年全省交通运输工作会议精神，部署全省道路运输重点工作。省交通运输厅党组成员、副厅长王昭春出席会议并讲话。省综合交通中心主任曾晓文、党委书记熊华武，省交通运输厅相关处室负责人，省综合交通中心在家领导，各设区市交通运输局分管道路运输工作领导、运输科和承担具体业务工作机构的主要负责同志参加会议。\n王昭春在讲话中从服务能力不断增强、转型发展成效显著、安全基础不断夯实、行业党建持续加强等四个方面充分肯定了2024年全省道路运输行业取得的成绩，并指出行业发展面临的困难和问题。', '省厅召开全省交通物流保通保畅工作专题调度会暨综合运输春运专班工作调度会\n2024-02-02\nhttp://jt.jiangxi.gov.cn/art/2024/2/2/art_32667_4779507.html', '2月21日，省综合交通运输发展研究中心工作会议召开，全面总结2024年工作，动员部署2025年工作，并对2024年度先进个人进行表扬。省交通运输厅党组成员、副厅长朱晗出席会议并讲话。厅规划处主要负责同志、中心全体干部职工参加会议。']","2024年全省综合运输春运工作电视电话会议召开
2024-01-25
http://jt.jiangxi.gov.cn/art/2024/1/25/art_32667_4770174.html",省交通运输厅党组成员、副厅长王昭春主持召开了2024年全省综合运输春运工作电视电话会议。,0.9999999999666667,1.0
在提升服务水平方面，客运枢纽将提供哪些特色服务？,"['。要全力确保路网畅通，加强对道路交通主干线和车站、机场、码头附近道路的指挥疏导，确保车辆有序通行；加强收费站设施设备的检查维护，确保车道全部正常运行。四要全面提升服务水平。要提高智慧春运水平，全面推行互联网售票，积极推广自助实名制核验通道，方便旅客快速进站。道路运输部门要进一步优化联网售票服务，扩展联网售票覆盖范围。民航部门要在重点机场进一步推广电子登机牌，实现“无纸化”便捷出行。要打造“温馨”出行环境，客运枢纽要在做好基本服务的基础上，积极为旅客提供特色服务。主要枢纽场站和服务区要设立爱心通道、母婴哺乳区、老弱病残孕旅客候车室，及时增设服务台和流动岗，方便旅客咨询。要突出“贴心”服务能力，开展“情满旅途”“暖冬行动”等主题活动，让旅客切实感受到春运旅途的温暖。各设区市、赣江新区交通运输、公安、应急、气象、邮政、公路、港航，以及铁路、民航等涉春运工作有关单位和部门负责同志在各分会场参加会议。（文/袁小金\u3000刘黄金\u3000图/刘黄金）', '（4）提升客货运输服务水平 打造高品质出行服务体系。一是优化城际客运网络。推广“一卡通”“一票式”“一码畅行” 等联程运输模式，推进具备条件的毗邻地区开行跨省、跨市公交线路，开展跨运输方式异地候机 候车、行李联托直挂等业务。二是推进城乡客运服务均等化。实施乡村运输“金通工程”，加快 发展农村客运预约响应式服务。三是建立公园城市绿色交通体系。推动轨道、街道、公交、慢行 系统多网融合，建设产城融合、站城一体的综合交通枢纽，积极发展准点公交、社区公交。', '。二是持续优化线路布局。通过调研等方式，细化工作举措，从织密重点景区间客运线路、提升旅游包车客运服务保障水平、推进区域内长线旅游客运优化运营等方面，进一步畅通“快达漫游”交通旅客运输网络。三是持续提升服务品质。严格要求各客运企业驾驶员考核、培训，定期对营运车辆做好维保工作，加强清洁和卫生管理，为旅客出行提供舒适的环境和周到的服务。四是持续推进“客货邮”融合。大力推广德兴“客货邮”融合典型做法，力争2025年在全市实现“客货邮”路线全覆盖；帮助旅游班线运营企业开展营销活动，利用营销平台进行定制车辆推广（针对老年人及大中专学生群体）。五是持续加大宣传力度。与市文广新旅局探索建设“乘车游上饶”模块的集“吃、住、行、娱、购、游”多功能于一体的APP，协调各景区给予班线运营企业旅游产品代理权等模式，实现交通服务与景区服务深度融合发展。在综合交通枢纽、客运场站、公交站台、高铁站、飞机场、港口码头等公共交通枢纽设置宣传牌和电子屏，推广文旅景点、文旅特色活动等信息。（徐芸）']",。要全力确保路网畅通，加强对道路交通主干线和车站、机场、码头附近道路的指挥疏导，确保车辆有序通行；加强收费站设施设备的检查维护，确保车道全部正常运行。四要全面提升服务水平。要提高智慧春运水平，全面推行互联网售票，积极推广自助实名制核验通道，方便旅客快速进站。道路运输部门要进一步优化联网售票服务，扩展联网售票覆盖范围。民航部门要在重点机场进一步推广电子登机牌，实现“无纸化”便捷出行。要打造“温馨”出行环境，客运枢纽要在做好基本服务的基础上，积极为旅客提供特色服务。主要枢纽场站和服务区要设立爱心通道、母婴哺乳区、老弱病残孕旅客候车室，及时增设服务台和流动岗，方便旅客咨询。要突出“贴心”服务能力，开展“情满旅途”“暖冬行动”等主题活动，让旅客切实感受到春运旅途的温暖。各设区市、赣江新区交通运输、公安、应急、气象、邮政、公路、港航，以及铁路、民航等涉春运工作有关单位和部门负责同志在各分会场参加会议。（文/袁小金　刘黄金　图/刘黄金）,客运枢纽将设立爱心通道、母婴哺乳区、老弱病残孕旅客候车室，及时增设服务台和流动岗，方便旅客咨询，并开展‘情满旅途’‘暖冬行动’等主题活动，让旅客切实感受到春运旅途的温暖。,0.9999999999666667,1.0
2024年全省高速公路联网管理委员会第二次工作会议的主要目的是什么？,"['12月27日，2024年全省高速公路联网管理委员会第二次工作会议召开，总结分析2024年全省高速公路联网管理工作，研究谋划2025年工作。厅党组成员、副厅长、全省高速公路联网管理委员会主任朱晗出席会议并讲话。\n朱晗指出，今年以来，各联网单位主动作为、通力协作、相互配合，在建设力度、管理手段、服务内容和技术创新等方面做了大量卓有成效的工作，为全省交通运输事业的高质量发展作出了重要贡献。\n朱晗强调，2025年是“十四五”的收官之年，做好2025年高速公路联网各项工作责任重大。各联网单位要用发展和动态的眼光来看待联网管理工作，要把运营管理和服务放在更加重要的位置，把握好2025年的工作重点；要持续聚焦主责主业，完善服务设施,回应公众关切，不断提高全省高速公路联网管理与服务的能力和水平，全力推动联网管理各项工作落实落地。', '2月20日，省综合交通中心在南昌召开全省道路运输工作部署会，贯彻落实2025年全省交通运输工作会议精神，部署全省道路运输重点工作。省交通运输厅党组成员、副厅长王昭春出席会议并讲话。省综合交通中心主任曾晓文、党委书记熊华武，省交通运输厅相关处室负责人，省综合交通中心在家领导，各设区市交通运输局分管道路运输工作领导、运输科和承担具体业务工作机构的主要负责同志参加会议。\n王昭春在讲话中从服务能力不断增强、转型发展成效显著、安全基础不断夯实、行业党建持续加强等四个方面充分肯定了2024年全省道路运输行业取得的成绩，并指出行业发展面临的困难和问题。', '2月14日，省智慧交通中心召开2025年工作会议，总结2024年工作，分析形势，部署2025年重点工作。\n2024年省智慧交通中心紧扣加快数字交通建设总体目标，凝心聚力启新程，踔厉奋发求突破，实现了支撑发展能力显著提升、项目建设管理质量不断提高、服务行业水平稳步提高、科技创新引领不断深化、安全稳定屏障全面筑牢、党建引领发展强劲有力。2025年将聚焦“走在前、勇争先、善作为”的目标要求，发展思路要实现从“量的积累”向“质的跃升”的转变、从“单打独斗”向“抱团发展”的转变、从“问鼎一域”到“竞逐全国”的转变，发展方向要实现紧跟国家政策走、紧跟实际需求走、紧跟新技术应用走，发展举措要实现与业务深度融合、标准体系深度融合、数据资源深度融合。']","12月27日，2024年全省高速公路联网管理委员会第二次工作会议召开，总结分析2024年全省高速公路联网管理工作，研究谋划2025年工作。厅党组成员、副厅长、全省高速公路联网管理委员会主任朱晗出席会议并讲话。
朱晗指出，今年以来，各联网单位主动作为、通力协作、相互配合，在建设力度、管理手段、服务内容和技术创新等方面做了大量卓有成效的工作，为全省交通运输事业的高质量发展作出了重要贡献。
朱晗强调，2025年是“十四五”的收官之年，做好2025年高速公路联网各项工作责任重大。各联网单位要用发展和动态的眼光来看待联网管理工作，要把运营管理和服务放在更加重要的位置，把握好2025年的工作重点；要持续聚焦主责主业，完善服务设施,回应公众关切，不断提高全省高速公路联网管理与服务的能力和水平，全力推动联网管理各项工作落实落地。",2024年全省高速公路联网管理委员会第二次工作会议的主要目的是总结分析2024年全省高速公路联网管理工作，并研究谋划2025年的工作计划。,0.9999999999666667,1.0
朱晗副厅长在会议上强调了哪些关于2025年高速公路联网管理工作的重点？,"['12月27日，2024年全省高速公路联网管理委员会第二次工作会议召开，总结分析2024年全省高速公路联网管理工作，研究谋划2025年工作。厅党组成员、副厅长、全省高速公路联网管理委员会主任朱晗出席会议并讲话。\n朱晗指出，今年以来，各联网单位主动作为、通力协作、相互配合，在建设力度、管理手段、服务内容和技术创新等方面做了大量卓有成效的工作，为全省交通运输事业的高质量发展作出了重要贡献。\n朱晗强调，2025年是“十四五”的收官之年，做好2025年高速公路联网各项工作责任重大。各联网单位要用发展和动态的眼光来看待联网管理工作，要把运营管理和服务放在更加重要的位置，把握好2025年的工作重点；要持续聚焦主责主业，完善服务设施,回应公众关切，不断提高全省高速公路联网管理与服务的能力和水平，全力推动联网管理各项工作落实落地。', '1月2日—3日，省交通运输厅党组成员、副厅长朱晗到上饶调研2024年高速公路春运保障各项准备工作情况，到厅定点帮扶村调研驻村和产业发展等工作。1月2日，朱晗赴梨温高速公路沿线服务区和上武高速公路铅山服务区、分水关隧道等地，详细了解梨温高速沿线服务区春运服务保障举措，重点了解了服务区外场停车区规划改造施工情况和公共卫生间卫生保障、临时卫生间搭建使用计划等“停车难”“如厕难”解决措施，认真听取了上武高速养护、运营等工作。朱晗指出，春运临近，各部门各单位要高度重视，认真部署。一是要组织专项排查，全力确保春运期间运营安全。要加强对服务区重点区域及养护薄弱环节的排查和整治，创建安全舒适的服务区整体环境，提前做好相关临时措施准备，确保春运期间高速公路安全形势平稳；二是要实施改造提升，全面提升高速运营管理水平。加快服务区提质升级及养护工程实施，按照既定方案尽快推进落实，严格管控工程质量，争取按时完工；三是要强化保障，探索建立高质量发展长效机制。通过强化制度建设、人员配置、资金投入等措施，确保各项制度落实到位，各项工作落实到位，全力推动高速公路运营管理和服务水平提档升级', '会上，朱晗充分肯定了省交通发展研究中心一年来所做的工作和取得的成绩，指出了存在的短板和弱项。就继续做好2025年工作，朱晗指出，一是要同心同向加强党的全面领导。中心党委要坚持把方向、管大局、抓落实，继续团结带领干部职工深入学习贯彻党的二十大和二十届三中全会精神，学习贯彻习近平总书记关于交通强国的重要论述和考察江西重要讲话精神，自觉增强“四个意识”、坚定“四个自信”、做到“两个维护”。二是要敢为善为服务交通强省建设。从全力以赴加快高水平交通强省建设发展大局的角度多想事、勤干事、善成事，切实为厅党组分忧、为厅机关解难、为交通运输发展研究事业尽责。集中精力落实好全省交通运输工作会议部署的重点工作，扎实推动交通运输发展研究事业高质量发展取得新成效。三是要群策群力激发干事创业活力。要在切实匡正干的导向、提升人才效能、营造干事创业良好氛围上多下功夫，调整优化各项考核制度和形式，调动干部职工干事创业的积极性、主动性、创造性，全力建设一支讲政治、精业务、能创新、敢担当的人才队伍。四是要不折不扣落实全面从严治党责任', '2月21日，省综合交通中心在南昌召开2025年全省农村公路工作部署会，落实全省交通运输工作会议精神，总结回顾2024年农村公路工作，部署2025年重点工作。省交通运输厅党组成员、副厅长朱晗出席会议并讲话，省综合交通中心主任曾晓文，厅公路处负责同志，省智慧交通中心相关负责同志，各设区市交通运输局分管农村公路工作领导、农村公路业务科室及承担具体业务工作机构的主要负责同志参加会议。会议通报了2024年度全省农村公路工作表现突出单位。\n朱晗在讲话中从超额完成年度投资建设任务、农村公路路网水平上新台阶、“四好农村路”建设取得新成效、交通强国试点成效位居全国前列四个方面充分肯定了2024年全省农村公路工作取得的成绩，并分析了新时代农村公路发展面临的形势和任务。']","12月27日，2024年全省高速公路联网管理委员会第二次工作会议召开，总结分析2024年全省高速公路联网管理工作，研究谋划2025年工作。厅党组成员、副厅长、全省高速公路联网管理委员会主任朱晗出席会议并讲话。
朱晗指出，今年以来，各联网单位主动作为、通力协作、相互配合，在建设力度、管理手段、服务内容和技术创新等方面做了大量卓有成效的工作，为全省交通运输事业的高质量发展作出了重要贡献。
朱晗强调，2025年是“十四五”的收官之年，做好2025年高速公路联网各项工作责任重大。各联网单位要用发展和动态的眼光来看待联网管理工作，要把运营管理和服务放在更加重要的位置，把握好2025年的工作重点；要持续聚焦主责主业，完善服务设施,回应公众关切，不断提高全省高速公路联网管理与服务的能力和水平，全力推动联网管理各项工作落实落地。",朱晗副厅长在会议上强调了以下关于2025年高速公路联网管理工作的重点：1. 注重安全稳定，提升联网收费系统运行水平；2. 坚持应征不漏，提高通行费实收率；3. 开展精准发行，提高ETC使用率；4. 运用科技手段，提升路网运行管理水平；5. 提前备战春运，抓好路网保通保畅工作。,0.8055555555287036,1.0
2025年全省农村公路工作部署会是在哪里召开的？,"['2月21日，省综合交通中心在南昌召开2025年全省农村公路工作部署会，落实全省交通运输工作会议精神，总结回顾2024年农村公路工作，部署2025年重点工作。省交通运输厅党组成员、副厅长朱晗出席会议并讲话，省综合交通中心主任曾晓文，厅公路处负责同志，省智慧交通中心相关负责同志，各设区市交通运输局分管农村公路工作领导、农村公路业务科室及承担具体业务工作机构的主要负责同志参加会议。会议通报了2024年度全省农村公路工作表现突出单位。\n朱晗在讲话中从超额完成年度投资建设任务、农村公路路网水平上新台阶、“四好农村路”建设取得新成效、交通强国试点成效位居全国前列四个方面充分肯定了2024年全省农村公路工作取得的成绩，并分析了新时代农村公路发展面临的形势和任务。', '2月20日，省综合交通中心在南昌召开全省道路运输工作部署会，贯彻落实2025年全省交通运输工作会议精神，部署全省道路运输重点工作。省交通运输厅党组成员、副厅长王昭春出席会议并讲话。省综合交通中心主任曾晓文、党委书记熊华武，省交通运输厅相关处室负责人，省综合交通中心在家领导，各设区市交通运输局分管道路运输工作领导、运输科和承担具体业务工作机构的主要负责同志参加会议。\n王昭春在讲话中从服务能力不断增强、转型发展成效显著、安全基础不断夯实、行业党建持续加强等四个方面充分肯定了2024年全省道路运输行业取得的成绩，并指出行业发展面临的困难和问题。', '2月14日，省智慧交通中心召开2025年工作会议，总结2024年工作，分析形势，部署2025年重点工作。\n2024年省智慧交通中心紧扣加快数字交通建设总体目标，凝心聚力启新程，踔厉奋发求突破，实现了支撑发展能力显著提升、项目建设管理质量不断提高、服务行业水平稳步提高、科技创新引领不断深化、安全稳定屏障全面筑牢、党建引领发展强劲有力。2025年将聚焦“走在前、勇争先、善作为”的目标要求，发展思路要实现从“量的积累”向“质的跃升”的转变、从“单打独斗”向“抱团发展”的转变、从“问鼎一域”到“竞逐全国”的转变，发展方向要实现紧跟国家政策走、紧跟实际需求走、紧跟新技术应用走，发展举措要实现与业务深度融合、标准体系深度融合、数据资源深度融合。', '12月27日，2024年全省高速公路联网管理委员会第二次工作会议召开，总结分析2024年全省高速公路联网管理工作，研究谋划2025年工作。厅党组成员、副厅长、全省高速公路联网管理委员会主任朱晗出席会议并讲话。\n朱晗指出，今年以来，各联网单位主动作为、通力协作、相互配合，在建设力度、管理手段、服务内容和技术创新等方面做了大量卓有成效的工作，为全省交通运输事业的高质量发展作出了重要贡献。\n朱晗强调，2025年是“十四五”的收官之年，做好2025年高速公路联网各项工作责任重大。各联网单位要用发展和动态的眼光来看待联网管理工作，要把运营管理和服务放在更加重要的位置，把握好2025年的工作重点；要持续聚焦主责主业，完善服务设施,回应公众关切，不断提高全省高速公路联网管理与服务的能力和水平，全力推动联网管理各项工作落实落地。', 'URL: https://jt.jiangxi.gov.cn/jxsjtyst/gzdt11/content/content_1881984938850615296.html\n\n为扎实做好迎接2025年全国干线公路养护管理评价工作，全面提升我省公路安全保护水平，努力营造“畅、安、舒、美”的公路通行环境，助力交通运输高质量发展，日前，省交通运输执法局启动公路路域环境综合整治活动。\n整治活动围绕“安全畅通、环境优美、服务优质”的治理要求，按照“政府主导、部门联动、综合治理”的工作原则，以清理整治公路、公路用地、公路两侧建筑控制区以及公路桥梁桥下空间范围内的违法建筑物、非公路标志、地面构造物为重点，通过深化公路沿线环境治理、加强公路沿线建筑物管控、强化公路桥梁和隧道保护、严格非公路标志标牌设置、规范涉路施工作业现场管理和规范公路平交道口管理等六项整治措施，进一步改善公路沿线两侧及周边环境面貌，提升公路交通服务整体质量，力争实现公路路域环境“八个无”目标。\n据悉，整治活动从2025年1月15日起，至2025年11月30日结束。（于文广）']","2月21日，省综合交通中心在南昌召开2025年全省农村公路工作部署会，落实全省交通运输工作会议精神，总结回顾2024年农村公路工作，部署2025年重点工作。省交通运输厅党组成员、副厅长朱晗出席会议并讲话，省综合交通中心主任曾晓文，厅公路处负责同志，省智慧交通中心相关负责同志，各设区市交通运输局分管农村公路工作领导、农村公路业务科室及承担具体业务工作机构的主要负责同志参加会议。会议通报了2024年度全省农村公路工作表现突出单位。
朱晗在讲话中从超额完成年度投资建设任务、农村公路路网水平上新台阶、“四好农村路”建设取得新成效、交通强国试点成效位居全国前列四个方面充分肯定了2024年全省农村公路工作取得的成绩，并分析了新时代农村公路发展面临的形势和任务。",2025年全省农村公路工作部署会是在南昌召开的。,0.8666666666377778,1.0
朱晗在会议上对2024年全省农村公路工作取得了哪些方面的成绩进行了充分肯定？,"['2月21日，省综合交通中心在南昌召开2025年全省农村公路工作部署会，落实全省交通运输工作会议精神，总结回顾2024年农村公路工作，部署2025年重点工作。省交通运输厅党组成员、副厅长朱晗出席会议并讲话，省综合交通中心主任曾晓文，厅公路处负责同志，省智慧交通中心相关负责同志，各设区市交通运输局分管农村公路工作领导、农村公路业务科室及承担具体业务工作机构的主要负责同志参加会议。会议通报了2024年度全省农村公路工作表现突出单位。\n朱晗在讲话中从超额完成年度投资建设任务、农村公路路网水平上新台阶、“四好农村路”建设取得新成效、交通强国试点成效位居全国前列四个方面充分肯定了2024年全省农村公路工作取得的成绩，并分析了新时代农村公路发展面临的形势和任务。', '会上，朱晗充分肯定了省交通发展研究中心一年来所做的工作和取得的成绩，指出了存在的短板和弱项。就继续做好2025年工作，朱晗指出，一是要同心同向加强党的全面领导。中心党委要坚持把方向、管大局、抓落实，继续团结带领干部职工深入学习贯彻党的二十大和二十届三中全会精神，学习贯彻习近平总书记关于交通强国的重要论述和考察江西重要讲话精神，自觉增强“四个意识”、坚定“四个自信”、做到“两个维护”。二是要敢为善为服务交通强省建设。从全力以赴加快高水平交通强省建设发展大局的角度多想事、勤干事、善成事，切实为厅党组分忧、为厅机关解难、为交通运输发展研究事业尽责。集中精力落实好全省交通运输工作会议部署的重点工作，扎实推动交通运输发展研究事业高质量发展取得新成效。三是要群策群力激发干事创业活力。要在切实匡正干的导向、提升人才效能、营造干事创业良好氛围上多下功夫，调整优化各项考核制度和形式，调动干部职工干事创业的积极性、主动性、创造性，全力建设一支讲政治、精业务、能创新、敢担当的人才队伍。四是要不折不扣落实全面从严治党责任', '12月27日，2024年全省高速公路联网管理委员会第二次工作会议召开，总结分析2024年全省高速公路联网管理工作，研究谋划2025年工作。厅党组成员、副厅长、全省高速公路联网管理委员会主任朱晗出席会议并讲话。\n朱晗指出，今年以来，各联网单位主动作为、通力协作、相互配合，在建设力度、管理手段、服务内容和技术创新等方面做了大量卓有成效的工作，为全省交通运输事业的高质量发展作出了重要贡献。\n朱晗强调，2025年是“十四五”的收官之年，做好2025年高速公路联网各项工作责任重大。各联网单位要用发展和动态的眼光来看待联网管理工作，要把运营管理和服务放在更加重要的位置，把握好2025年的工作重点；要持续聚焦主责主业，完善服务设施,回应公众关切，不断提高全省高速公路联网管理与服务的能力和水平，全力推动联网管理各项工作落实落地。', '1月17日，全省交通运输执法工作会议召开，总结2023年工作，分析形势、理清思路、明确目标，安排部署2024年重点工作。省交通运输厅党组成员、副厅长朱晗出席会议并讲话，省交通运输执法局局长毛茂作全省交通运输执法工作报告，党委书记娄鸿雁作总结讲话。会议发布了2023年全省交通运输执法“十件大事”，通报了2023年度全省交通运输执法工作表现突出单位。朱晗从“执法队伍素质能力水平明显提升、服务保障中心工作成效持续彰显、党建引领高质量发展更加坚强有力”三个方面对全省交通运输执法系统一年来的工作成绩给予了充分肯定，并立足经济社会发展大局和交通运输工作全局，科学分析了当前交通运输执法工作面临的新形势、新任务。就做好下一步交通运输执法工作，朱晗强调，一是要聚焦高质量发展，构建深化改革的创新格局。要纵深推进综合执法改革、“四基四化”建设、科技创新赋能，形成联合执法监管合力，实现精准管控、精准执法。二是要聚焦高水平安全，构建持续稳定的发展基础']","2月21日，省综合交通中心在南昌召开2025年全省农村公路工作部署会，落实全省交通运输工作会议精神，总结回顾2024年农村公路工作，部署2025年重点工作。省交通运输厅党组成员、副厅长朱晗出席会议并讲话，省综合交通中心主任曾晓文，厅公路处负责同志，省智慧交通中心相关负责同志，各设区市交通运输局分管农村公路工作领导、农村公路业务科室及承担具体业务工作机构的主要负责同志参加会议。会议通报了2024年度全省农村公路工作表现突出单位。
朱晗在讲话中从超额完成年度投资建设任务、农村公路路网水平上新台阶、“四好农村路”建设取得新成效、交通强国试点成效位居全国前列四个方面充分肯定了2024年全省农村公路工作取得的成绩，并分析了新时代农村公路发展面临的形势和任务。",朱晗在会议上从超额完成年度投资建设任务、农村公路路网水平上新台阶、“四好农村路”建设取得新成效、交通强国试点成效位居全国前列四个方面充分肯定了2024年全省农村公路工作取得的成绩。,0.9166666666361111,1.0
在2025年全省水路交通运输工作会议上，哪位领导做了全省水路交通运输工作报告？,"['2\n月\n6\n日，全省水路交通运输工作会议在昌召开，传达全国、全省交通运输工作会议精神，总结\n2024\n年水路运输工作，分析形势，部署\n2025\n年重点工作。省交通运输厅党组成员、副厅长王昭春出席会议并讲话，省高航中心党委书记陈鹏程作全省水路交通运输工作报告。会议通报了\n2024\n年度全省高航工作表现突出单位、集体和个人，全省港口、航运服务工作表现突出单位、集体和个人。\n王昭春充分肯定了\n2024\n年省高航中心所做的工作和取得的成绩，他指出，过去的一年，全省水运发展取得较好成效，水运服务保障能力持续提升，水运绿色智慧转型稳步推进，“赣航先锋”行业党建品牌成效初显，党建引领作用更加凸显。\n就做好\n2025', '1月23日，全省水路交通运输工作会议在昌召开。会议全面总结了2023年全省水路交通运输工作,安排部署了2024 年重点工作。省交通运输厅党组成员、副厅长王昭春出席会议并讲话，省高航中心主任易宗发作全省水路交通运输工作报告，党委书记陈鹏程主持会议并讲话。会议通报了2023年度表现突出单位、集体和个人。王昭春在讲话中充分肯定了省高航中心过去一年所做的工作和取得的成绩。他指出，过去的一年，省高航中心各项工作成效明显，水运经济运行稳中向好、航道管养模式持续深化、安全生产形势保持稳定、党的建设工作走深走实。就做好2024年全省水运工作，王昭春指出，一要加强政治理论和业务学习，坚决贯彻落实党中央、国务院和省委省政府决策部署。要强化政治学习和业务学习，进一步学习贯彻习近平新时代中国特色社会主义思想，坚持不懈用习近平新时代中国特色社会主义思想武装头脑、指导实践、推动工作。熟练掌握工作有关法律法规、政策、程序，将业务学习与工作实践紧密结合，提高业务能力和工作水平，努力成为本职工作里的行家里手。二要全力以赴抓落实,确保全年水路交通运输高质量发展目标任务圆满完成']","2
月
6
日，全省水路交通运输工作会议在昌召开，传达全国、全省交通运输工作会议精神，总结
2024
年水路运输工作，分析形势，部署
2025
年重点工作。省交通运输厅党组成员、副厅长王昭春出席会议并讲话，省高航中心党委书记陈鹏程作全省水路交通运输工作报告。会议通报了
2024
年度全省高航工作表现突出单位、集体和个人，全省港口、航运服务工作表现突出单位、集体和个人。
王昭春充分肯定了
2024
年省高航中心所做的工作和取得的成绩，他指出，过去的一年，全省水运发展取得较好成效，水运服务保障能力持续提升，水运绿色智慧转型稳步推进，“赣航先锋”行业党建品牌成效初显，党建引领作用更加凸显。
就做好
2025",省高航中心党委书记陈鹏程在2025年全省水路交通运输工作会议上做了全省水路交通运输工作报告。,0.99999999995,1.0
王昭春副厅长在会议上对2024年省高航中心的工作和成绩持何种态度？,"['1月23日，全省水路交通运输工作会议在昌召开。会议全面总结了2023年全省水路交通运输工作,安排部署了2024 年重点工作。省交通运输厅党组成员、副厅长王昭春出席会议并讲话，省高航中心主任易宗发作全省水路交通运输工作报告，党委书记陈鹏程主持会议并讲话。会议通报了2023年度表现突出单位、集体和个人。王昭春在讲话中充分肯定了省高航中心过去一年所做的工作和取得的成绩。他指出，过去的一年，省高航中心各项工作成效明显，水运经济运行稳中向好、航道管养模式持续深化、安全生产形势保持稳定、党的建设工作走深走实。就做好2024年全省水运工作，王昭春指出，一要加强政治理论和业务学习，坚决贯彻落实党中央、国务院和省委省政府决策部署。要强化政治学习和业务学习，进一步学习贯彻习近平新时代中国特色社会主义思想，坚持不懈用习近平新时代中国特色社会主义思想武装头脑、指导实践、推动工作。熟练掌握工作有关法律法规、政策、程序，将业务学习与工作实践紧密结合，提高业务能力和工作水平，努力成为本职工作里的行家里手。二要全力以赴抓落实,确保全年水路交通运输高质量发展目标任务圆满完成', '2\n月\n6\n日，全省水路交通运输工作会议在昌召开，传达全国、全省交通运输工作会议精神，总结\n2024\n年水路运输工作，分析形势，部署\n2025\n年重点工作。省交通运输厅党组成员、副厅长王昭春出席会议并讲话，省高航中心党委书记陈鹏程作全省水路交通运输工作报告。会议通报了\n2024\n年度全省高航工作表现突出单位、集体和个人，全省港口、航运服务工作表现突出单位、集体和个人。\n王昭春充分肯定了\n2024\n年省高航中心所做的工作和取得的成绩，他指出，过去的一年，全省水运发展取得较好成效，水运服务保障能力持续提升，水运绿色智慧转型稳步推进，“赣航先锋”行业党建品牌成效初显，党建引领作用更加凸显。\n就做好\n2025', '2月20日，省综合交通中心在南昌召开全省道路运输工作部署会，贯彻落实2025年全省交通运输工作会议精神，部署全省道路运输重点工作。省交通运输厅党组成员、副厅长王昭春出席会议并讲话。省综合交通中心主任曾晓文、党委书记熊华武，省交通运输厅相关处室负责人，省综合交通中心在家领导，各设区市交通运输局分管道路运输工作领导、运输科和承担具体业务工作机构的主要负责同志参加会议。\n王昭春在讲话中从服务能力不断增强、转型发展成效显著、安全基础不断夯实、行业党建持续加强等四个方面充分肯定了2024年全省道路运输行业取得的成绩，并指出行业发展面临的困难和问题。', '1月24日， 在收看2024年全国综合运输春运工作电视电话会议后，省交通运输厅党组成员、副厅长王昭春主持召开2024年全省综合运输春运工作电视电话会议。省公安厅党委委员万秀奇，省应急管理厅党委委员、副厅长徐何明及省气象局、民航江西监管局、省邮政管理局、省机场集团有限公司、中国铁路南昌局集团有限公司和厅直属有关单位负责同志参加会议。王昭春指出，各地、各有关部门要紧密结合当地实际，科学制定运输组织方案，压实安全生产工作责任制，提前做好应急准备，全面提升服务水平，全力做好保畅通、保安全工作。一要加强运输组织保障。要优化运力调配，铁路部门要最大限度增加重点方向、客流集中地区和高峰时段的客运能力，同时保持普速旅客列车开行规模。民航部门要注重干支线结合，强化运力调配和机务保障。道路水路运输部门要加强客流密集地区运力供给，优化车船发班频次和生产调度，提高运输能力。要加强联程联运调度，要根据客流量适时增加线路运力、延长运营时间，积极开展道路客运定制服务，做好短途接驳，畅通出行“最后一公里”。要引导公众理性错峰出行，及时发布公路路况、交通管制、分流绕行、恶劣天气安全出行提示等信息，引导旅客合理安排出行线路']","1月23日，全省水路交通运输工作会议在昌召开。会议全面总结了2023年全省水路交通运输工作,安排部署了2024 年重点工作。省交通运输厅党组成员、副厅长王昭春出席会议并讲话，省高航中心主任易宗发作全省水路交通运输工作报告，党委书记陈鹏程主持会议并讲话。会议通报了2023年度表现突出单位、集体和个人。王昭春在讲话中充分肯定了省高航中心过去一年所做的工作和取得的成绩。他指出，过去的一年，省高航中心各项工作成效明显，水运经济运行稳中向好、航道管养模式持续深化、安全生产形势保持稳定、党的建设工作走深走实。就做好2024年全省水运工作，王昭春指出，一要加强政治理论和业务学习，坚决贯彻落实党中央、国务院和省委省政府决策部署。要强化政治学习和业务学习，进一步学习贯彻习近平新时代中国特色社会主义思想，坚持不懈用习近平新时代中国特色社会主义思想武装头脑、指导实践、推动工作。熟练掌握工作有关法律法规、政策、程序，将业务学习与工作实践紧密结合，提高业务能力和工作水平，努力成为本职工作里的行家里手。二要全力以赴抓落实,确保全年水路交通运输高质量发展目标任务圆满完成",王昭春副厅长充分肯定了2024年省高航中心所做的工作和取得的成绩，认为过去的一年全省水运发展取得较好成效。,0.999999999975,1.0
2025年全省道路运输工作部署会是在哪里召开的？,"['2月20日，省综合交通中心在南昌召开全省道路运输工作部署会，贯彻落实2025年全省交通运输工作会议精神，部署全省道路运输重点工作。省交通运输厅党组成员、副厅长王昭春出席会议并讲话。省综合交通中心主任曾晓文、党委书记熊华武，省交通运输厅相关处室负责人，省综合交通中心在家领导，各设区市交通运输局分管道路运输工作领导、运输科和承担具体业务工作机构的主要负责同志参加会议。\n王昭春在讲话中从服务能力不断增强、转型发展成效显著、安全基础不断夯实、行业党建持续加强等四个方面充分肯定了2024年全省道路运输行业取得的成绩，并指出行业发展面临的困难和问题。', '2月21日，省综合交通中心在南昌召开2025年全省农村公路工作部署会，落实全省交通运输工作会议精神，总结回顾2024年农村公路工作，部署2025年重点工作。省交通运输厅党组成员、副厅长朱晗出席会议并讲话，省综合交通中心主任曾晓文，厅公路处负责同志，省智慧交通中心相关负责同志，各设区市交通运输局分管农村公路工作领导、农村公路业务科室及承担具体业务工作机构的主要负责同志参加会议。会议通报了2024年度全省农村公路工作表现突出单位。\n朱晗在讲话中从超额完成年度投资建设任务、农村公路路网水平上新台阶、“四好农村路”建设取得新成效、交通强国试点成效位居全国前列四个方面充分肯定了2024年全省农村公路工作取得的成绩，并分析了新时代农村公路发展面临的形势和任务。', '2月14日，省智慧交通中心召开2025年工作会议，总结2024年工作，分析形势，部署2025年重点工作。\n2024年省智慧交通中心紧扣加快数字交通建设总体目标，凝心聚力启新程，踔厉奋发求突破，实现了支撑发展能力显著提升、项目建设管理质量不断提高、服务行业水平稳步提高、科技创新引领不断深化、安全稳定屏障全面筑牢、党建引领发展强劲有力。2025年将聚焦“走在前、勇争先、善作为”的目标要求，发展思路要实现从“量的积累”向“质的跃升”的转变、从“单打独斗”向“抱团发展”的转变、从“问鼎一域”到“竞逐全国”的转变，发展方向要实现紧跟国家政策走、紧跟实际需求走、紧跟新技术应用走，发展举措要实现与业务深度融合、标准体系深度融合、数据资源深度融合。', '1月17日，全省交通运输执法工作会议召开，总结2023年工作，分析形势、理清思路、明确目标，安排部署2024年重点工作。省交通运输厅党组成员、副厅长朱晗出席会议并讲话，省交通运输执法局局长毛茂作全省交通运输执法工作报告，党委书记娄鸿雁作总结讲话。会议发布了2023年全省交通运输执法“十件大事”，通报了2023年度全省交通运输执法工作表现突出单位。朱晗从“执法队伍素质能力水平明显提升、服务保障中心工作成效持续彰显、党建引领高质量发展更加坚强有力”三个方面对全省交通运输执法系统一年来的工作成绩给予了充分肯定，并立足经济社会发展大局和交通运输工作全局，科学分析了当前交通运输执法工作面临的新形势、新任务。就做好下一步交通运输执法工作，朱晗强调，一是要聚焦高质量发展，构建深化改革的创新格局。要纵深推进综合执法改革、“四基四化”建设、科技创新赋能，形成联合执法监管合力，实现精准管控、精准执法。二是要聚焦高水平安全，构建持续稳定的发展基础', '2\n月\n6\n日，全省水路交通运输工作会议在昌召开，传达全国、全省交通运输工作会议精神，总结\n2024\n年水路运输工作，分析形势，部署\n2025\n年重点工作。省交通运输厅党组成员、副厅长王昭春出席会议并讲话，省高航中心党委书记陈鹏程作全省水路交通运输工作报告。会议通报了\n2024\n年度全省高航工作表现突出单位、集体和个人，全省港口、航运服务工作表现突出单位、集体和个人。\n王昭春充分肯定了\n2024\n年省高航中心所做的工作和取得的成绩，他指出，过去的一年，全省水运发展取得较好成效，水运服务保障能力持续提升，水运绿色智慧转型稳步推进，“赣航先锋”行业党建品牌成效初显，党建引领作用更加凸显。\n就做好\n2025']","2月20日，省综合交通中心在南昌召开全省道路运输工作部署会，贯彻落实2025年全省交通运输工作会议精神，部署全省道路运输重点工作。省交通运输厅党组成员、副厅长王昭春出席会议并讲话。省综合交通中心主任曾晓文、党委书记熊华武，省交通运输厅相关处室负责人，省综合交通中心在家领导，各设区市交通运输局分管道路运输工作领导、运输科和承担具体业务工作机构的主要负责同志参加会议。
王昭春在讲话中从服务能力不断增强、转型发展成效显著、安全基础不断夯实、行业党建持续加强等四个方面充分肯定了2024年全省道路运输行业取得的成绩，并指出行业发展面临的困难和问题。",2025年全省道路运输工作部署会是在南昌召开的。,0.8666666666377778,1.0
王昭春在讲话中肯定了2024年全省道路运输行业在哪些方面取得的成绩？,"['2月20日，省综合交通中心在南昌召开全省道路运输工作部署会，贯彻落实2025年全省交通运输工作会议精神，部署全省道路运输重点工作。省交通运输厅党组成员、副厅长王昭春出席会议并讲话。省综合交通中心主任曾晓文、党委书记熊华武，省交通运输厅相关处室负责人，省综合交通中心在家领导，各设区市交通运输局分管道路运输工作领导、运输科和承担具体业务工作机构的主要负责同志参加会议。\n王昭春在讲话中从服务能力不断增强、转型发展成效显著、安全基础不断夯实、行业党建持续加强等四个方面充分肯定了2024年全省道路运输行业取得的成绩，并指出行业发展面临的困难和问题。', '1月23日，全省水路交通运输工作会议在昌召开。会议全面总结了2023年全省水路交通运输工作,安排部署了2024 年重点工作。省交通运输厅党组成员、副厅长王昭春出席会议并讲话，省高航中心主任易宗发作全省水路交通运输工作报告，党委书记陈鹏程主持会议并讲话。会议通报了2023年度表现突出单位、集体和个人。王昭春在讲话中充分肯定了省高航中心过去一年所做的工作和取得的成绩。他指出，过去的一年，省高航中心各项工作成效明显，水运经济运行稳中向好、航道管养模式持续深化、安全生产形势保持稳定、党的建设工作走深走实。就做好2024年全省水运工作，王昭春指出，一要加强政治理论和业务学习，坚决贯彻落实党中央、国务院和省委省政府决策部署。要强化政治学习和业务学习，进一步学习贯彻习近平新时代中国特色社会主义思想，坚持不懈用习近平新时代中国特色社会主义思想武装头脑、指导实践、推动工作。熟练掌握工作有关法律法规、政策、程序，将业务学习与工作实践紧密结合，提高业务能力和工作水平，努力成为本职工作里的行家里手。二要全力以赴抓落实,确保全年水路交通运输高质量发展目标任务圆满完成', '2\n月\n6\n日，全省水路交通运输工作会议在昌召开，传达全国、全省交通运输工作会议精神，总结\n2024\n年水路运输工作，分析形势，部署\n2025\n年重点工作。省交通运输厅党组成员、副厅长王昭春出席会议并讲话，省高航中心党委书记陈鹏程作全省水路交通运输工作报告。会议通报了\n2024\n年度全省高航工作表现突出单位、集体和个人，全省港口、航运服务工作表现突出单位、集体和个人。\n王昭春充分肯定了\n2024\n年省高航中心所做的工作和取得的成绩，他指出，过去的一年，全省水运发展取得较好成效，水运服务保障能力持续提升，水运绿色智慧转型稳步推进，“赣航先锋”行业党建品牌成效初显，党建引领作用更加凸显。\n就做好\n2025', '1月24日， 在收看2024年全国综合运输春运工作电视电话会议后，省交通运输厅党组成员、副厅长王昭春主持召开2024年全省综合运输春运工作电视电话会议。省公安厅党委委员万秀奇，省应急管理厅党委委员、副厅长徐何明及省气象局、民航江西监管局、省邮政管理局、省机场集团有限公司、中国铁路南昌局集团有限公司和厅直属有关单位负责同志参加会议。王昭春指出，各地、各有关部门要紧密结合当地实际，科学制定运输组织方案，压实安全生产工作责任制，提前做好应急准备，全面提升服务水平，全力做好保畅通、保安全工作。一要加强运输组织保障。要优化运力调配，铁路部门要最大限度增加重点方向、客流集中地区和高峰时段的客运能力，同时保持普速旅客列车开行规模。民航部门要注重干支线结合，强化运力调配和机务保障。道路水路运输部门要加强客流密集地区运力供给，优化车船发班频次和生产调度，提高运输能力。要加强联程联运调度，要根据客流量适时增加线路运力、延长运营时间，积极开展道路客运定制服务，做好短途接驳，畅通出行“最后一公里”。要引导公众理性错峰出行，及时发布公路路况、交通管制、分流绕行、恶劣天气安全出行提示等信息，引导旅客合理安排出行线路']","2月20日，省综合交通中心在南昌召开全省道路运输工作部署会，贯彻落实2025年全省交通运输工作会议精神，部署全省道路运输重点工作。省交通运输厅党组成员、副厅长王昭春出席会议并讲话。省综合交通中心主任曾晓文、党委书记熊华武，省交通运输厅相关处室负责人，省综合交通中心在家领导，各设区市交通运输局分管道路运输工作领导、运输科和承担具体业务工作机构的主要负责同志参加会议。
王昭春在讲话中从服务能力不断增强、转型发展成效显著、安全基础不断夯实、行业党建持续加强等四个方面充分肯定了2024年全省道路运输行业取得的成绩，并指出行业发展面临的困难和问题。",王昭春在讲话中肯定了2024年全省道路运输行业在服务能力不断增强、转型发展成效显著、安全基础不断夯实、行业党建持续加强等四个方面取得的成绩。,0.999999999975,1.0
